{
  "planVersion": "1",
  "summary": "Keep the bed and add freestanding storage.",
  "designStyle": "SCANDINAVIAN",
  "actions": [
    {
      "objectId": "11111111-1111-4111-8111-111111111111",
      "objectClass": "bed",
      "decision": "KEEP",
      "type": "KEEP",
      "instruction": "Keep the bed on its current wall.",
      "rationale": "Respect the saved KEEP choice."
    }
  ],
  "layoutNotes": [
    "Verify clearances in person."
  ],
  "budgetAllocation": [
    {
      "category": "storage",
      "item": "Freestanding shelf",
      "purpose": "Add storage without drilling.",
      "estimatedCost": 1000
    }
  ],
  "estimatedTotalCost": 1000,
  "currency": "TWD",
  "warnings": [
    "Concept only; measurements need verification."
  ],
  "itemsNeeded": [
    {
      "objectId": null,
      "name": "Freestanding shelf",
      "quantity": 1
    }
  ],
  "rentalFriendlyWarnings": [
    "Check lease terms before making changes."
  ],
  "constraints": [
    "No permanent drilling, repainting, built-ins or flooring."
  ]
}
